start	end	text
1366000	1368000	You were the people from Mahantum Ha'udah,
1368000	1372000	Takhtulun Anfusakum Wa Toqriyuna Fariqa Minkum Min Diyaarihim.
1372000	1376000	You were the same people who used to kill each other.
1376000	1379000	They were Muslims, killing other Muslims.
1379000	1382000	But then, and then you were killing, you were expelling them,
1382000	1384000	your own people from your own homes,
1384000	1387000	and you were taking over each other's properties,
1387000	1389000	T'allah Aruna Aalaihim Bilal I.
1389000	1392000	You were making aggressive moves against each other,
1392000	1395000	invading each other's properties, taking each other's land and things like that.
1395000	1398000	But then after you fought each other,
1398000	1402000	by the way, when the Muslims fought each other, they became weak.
1402000	1405000	If a family is having fights within itself, the family is weak,
1405000	1408000	which means it's easier to attack from the outside.
1408000	1412000	So when the Israelites fought each other, other nations saw that they're weak.
1412000	1414000	So they started invading them.
1414000	1416000	When they invaded them, many of them became slaves.
1416000	1420000	Then they would have fundraisers, our Muslim brothers are being tortured.
1420000	1423000	Please, raise some money so we can free our Muslim brothers.
1423000	1425000	Wa In Ya'atukum Musaara Tufaduhum
1425000	1429000	When they come to you as slaves, you go and pay money to rescue them.
1429000	1431000	You want to raise money for that cause.
1431000	1434000	Wa Wa Mu'harramun Aalaikum Ikhrajuhum
1434000	1437000	Kicking them out of their homes in the first place was haram for you.
1437000	1440000	You created a conflict that led them to become this way,
1440000	1444000	and then you want to come and rescue them. This is what Tufrah says.
1444000	1448000	The first was the infighting, and then there was a whole help your fellow brother.
1448000	1451000	This hypocrisy was created within them.
1451000	1453000	Okay, then,
1453000	1456000	Ifa Tugliluna Bi Ba'ud Lil Kitabi Wa Takt Furuna Bi Ba'ud
1456000	1461000	Do you believe in some parts of the book and just completely reject other parts of the book?
1461000	1464000	Fa Maa Jazaa'u Ma Ya'f'alu Dhalika
1464000	1468000	Inlaa Khizyul Fi Al Hayatul Dunyaa
1468000	1471000	What could be the payback for someone who does something like that,
1471000	1473000	except they should be humiliated in this light?
1473000	1475000	They should live in humiliation.
1475000	1478000	Wa Yaumal Qiyamati Yuradunaylaa Shadil Adab
1478000	1482000	In the Day of Resurrection, they will be taken back to the worst of punishments.
1482000	1486000	Oh, this one's scary. Wa Qaalul Qulubuna Wulf
1486000	1490000	They said, our hearts are wrapped up.
1490000	1494000	Our hearts are safe, no matter what.
1494000	1498000	As bad as I am, I still have iman in my heart.
1498000	1501000	It doesn't matter how... Okay, ya, this is haram, this is haram, this is haram.
1501000	1504000	I do a lot of haram, but I'm a good person.
1504000	1507000	In my heart, I'm still a good person.
1507000	1510000	You should know that. Don't judge my heart.
1510000	1512000	My heart is still good.
1512000	1513000	O' Allah says,
1513000	1515000	Allaahubu'Allah bi Kufrihim
1515000	1517000	Allah crush them because they're denial.
1517000	1520000	Fa Qalilam Ma Ya'yut Bilun. How little they have faith.
1520000	1522000	This way of saying, ya, ya, ya, I'd shut.
1522000	1527000	You're right, I do a lot of bad things, but I'm not that bad because deep down inside...
1527000	1530000	Deep down, really deep down.
1530000	1534000	Wa Lammaa Jaaahum Kitabubin A'indil Nahi Musaddikul Dima Maaahum
1534000	1537000	And when they would make predictions of the future,
1537000	1541000	that when the final prophet comes, you will see,
1541000	1543000	Oh, it's gonna be awesome. We're gonna win.
1543000	1545000	Ah, that sounds familiar.
1545000	1550000	When the signs of judgment take come, then the Muslims are gonna...
1550000	1553000	Right now though, my heart's in a good place.
1553000	1558000	Wa Qalilam Min Kumli Astaftihaun A'adil Adha Bina Qafal. Okay.
1558000	1561000	Allah says to them, Listen.
1561000	1563000	He holds the mountain above them.
1563000	1565000	He scares them and says,
1565000	1567000	Hold on to what I'm giving you with might.
1567000	1569000	Wa Saba'u, Listen.
1569000	1571000	Qa'udu Sama'ana Wa As-Sina.
1571000	1573000	They say, We heard and we disobeyed.
1573000	1575000	You know what this is? Let me tell you.
1575000	1577000	Sometimes Allah scares people.
1578000	1580000	He puts them in a very scary situation.
1580000	1584000	And in that scary situation, they realize they must obey Allah.
1584000	1586000	And soon after that scary situation,
1586000	1589000	when the scary situation is gone, what happens to those people?
1589000	1592000	They're gonna...
1592000	1594000	Allah's not mad anymore.
1594000	1597000	I think I can go back to normal now.
1597000	1600000	Like Allah gives the analogy of even non-believers,
1600000	1603000	you know, when they're traveling by sea and the sea becomes turbulent,
1603000	1605000	they all start remembering Allah.
1605000	1609000	Right? If you're on a plane and the medical mouth mask falls.
1609000	1611000	Right?
1616000	1618000	Oops, sorry.
1618000	1620000	The pilot fell asleep.
1620000	1622000	You can put the medical mouth mask back up.
1622000	1625000	Okay, well, I'll go back to Netflix then.
1628000	1629000	Right?
1629000	1630000	So there's a...
1630000	1633000	And the idea here is actually even more than that.
1633000	1635000	They were shaken up and they were told,
1635000	1638000	listen to what we are giving you seriously.
1638000	1640000	And hold on to it.
1640000	1643000	And they said, we hear, but later on, even though they heard it,
1643000	1645000	they still disobeyed.
1645000	1647000	And then Allah says, has a punishment.
1647000	1649000	This is a punishment from Allah when people hear the word of Allah
1649000	1654000	and they don't care that Allah puts the love of filthy things in their hearts.
1654000	1655000	He says,
1658000	1661000	You know, they ended up loving the worship of a cow.
1661000	1663000	And they were obsessed with it.
1663000	1665000	Where did that filthy love come from?
1665000	1666000	It's shirk.
1666000	1667000	You're a Muslim.
1667000	1668000	How could you just do shirk like that?
1668000	1673000	That's the punishment of hearing the word of Allah after being shaken up
1673000	1674000	and still dismissing it.
1674000	1678000	Well, you want to dismiss it, then Allah does not reside in your heart.
1678000	1679000	Then you...
1679000	1681000	He'll allow that heart to be flooded with all kinds of shirk
1681000	1683000	and creepy weird practices.
1683000	1686000	And you'll find, I don't have to spell this out to you,
1686000	1689000	but there's no shortage of weird shirk-y,
1689000	1693000	total idol worship type practices across the Muslim world.
1693000	1697000	Total idol worship type, like crazy, and they call themselves Muslim.
1697000	1700000	And they do the most like non-Muslim things.
1700000	1701000	Openly.
1701000	1705000	I was told that I promised to stop my worship
1705000	1707000	but most of them made a promise breaking.
1707000	1710000	Every time they made any promise, they threw it away.
1710000	1712000	They couldn't keep any promises.
1712000	1715000	I learned this the hard way in Pakistan.
1715000	1717000	I thought things would get better.
1717000	1719000	You know what I learned about Islam?
1719000	1721000	When somebody says, don't worry about it at all.
1721000	1722000	Done.
1722000	1723000	Take care.
1723000	1725000	That's when you should worry.
1725000	1729000	When the guy says,
1729000	1731000	I'm thinking about it, I don't know.
1731000	1734000	Oh my God.
1734000	1739000	The more guarantees, the more guarantees,
1739000	1741000	the more lies.
1741000	1742000	Why?
1742000	1743000	Why?
1743000	1745000	Allah says every time they made any promise,
1745000	1746000	they threw it behind their back.
1746000	1749000	I was speaking to a senior in Pakistan intellectual,
1749000	1750000	became a friend of mine.
1750000	1752000	I love making friends with elders.
1752000	1753000	They're just so wise.
1753000	1756000	He said, you know what our problem is in our country?
1756000	1759000	We're just in the habit of lying about the smallest things.
1759000	1761000	We just have to lie.
1761000	1763000	We don't even have, there's no reason.
1763000	1764000	We still do it.
1764000	1765000	We still do it.
1765000	1771000	You're like, your friend is waiting for you at the door, right?
1771000	1773000	And he calls you and says, you coming?
1773000	1775000	You could say, I need five minutes.
1775000	1777000	You say, no, no, I'm already down the stairs.
1777000	1778000	I'm right there, bro.
1778000	1779000	I'm right there.
1779000	1781000	Just 10 seconds, 10 minutes later.
1781000	1782000	Right?
1782000	1787000	There was no reason to lie, but you still have to do it.
1787000	1788000	You know?
1788000	1791000	Hey, have you finished the Saim-e-Dalagi-Bu?
1791000	1792000	Alhamdulillah.
1797000	1799000	You guys are unrelated, Alhamdulillah.
1799000	1800000	I wasn't related to what you said.
1800000	1802000	I was just saying praise the Lord to Allah.
1802000	1806000	Then here's the other scary one.
1806000	1817000	You will find them the most desiring of living.
1817000	1819000	They just want to live.
1819000	1821000	They just don't want to die.
1821000	1824000	Even more than the people who do shirk.
1824000	1827000	Each one of them wants to live a thousand years.
1827000	1829000	You know how this is a new one.
1829000	1831000	I didn't think this would happen to us, but a lot of people
1831000	1834000	Muslims come up to me, young and old.
1834000	1836000	I have a real fear of dying.
1836000	1838000	I just don't want to die.
1838000	1839000	Why do you lucky death?
1839000	1840000	I have nightmares about dying.
1840000	1842000	Why are you afraid of dying?
1842000	1844000	We came from Allah.
1844000	1846000	We return back to Allah.
1846000	1847000	This is an episode of our life.
1847000	1849000	This is not the end of our life.
1849000	1854000	I met a doctor who told me he deals with patients that are on the verge of death.
1854000	1855000	You know?
1855000	1858000	And sometimes he has to tell the family he only has a month left.
1858000	1860000	He has two weeks left.
1860000	1864000	If you'd like to take him off the machine and take them home or whatever,
1864000	1868000	take them off dialysis, etc., then it's your choice.
1868000	1874000	And he says, man, I deal with atheist families, Jewish families, Christian families, Hindu families,
1874000	1876000	all kinds of Muslim families.
1876000	1879000	And the only families to say, no, no, no, he cannot die.
1879000	1880000	He cannot die.
1880000	1881000	Keep him on the machine.
1881000	1882000	I know his brain is not working anymore.
1882000	1884000	But no, no, no, that cannot be.
1884000	1885000	We cannot have him die.
1885000	1888000	The only families that do that are the Muslim families.
1889000	1891000	Everybody else says he had a good life.
1891000	1892000	The atheist says I had a good life.
1892000	1893000	Let me go in peace.
1893000	1896000	They have no problem.
1896000	1898000	The Hindu says, okay, I'll come back.
1898000	1899000	Karma, I'll come back.
1899000	1901000	Patelliteb, whatever, I'll come back.
1901000	1908000	The only people now that cannot accept the notion of death, how could this happen?
1908000	1909000	How could death happen?
1909000	1911000	No, no, no, they're still alive.
1911000	1912000	They can't go.
1912000	1913000	They can't go.
1913000	1915000	And they can't accept it over and over again.
1915000	1917000	You know what Allah did with us?
1917000	1923000	We don't hand the body over to a cremation company so they can deal with it.
1923000	1927000	Or to a company that embalms the body or who washes the body?
1927000	1929000	The family members.
1929000	1932000	Who puts the coffin on the body?
1932000	1933000	The family members.
1933000	1936000	Traditionally, who put the body in the grave?
1936000	1938000	The family, why?
1938000	1944000	Because Allah's, this religion teaches you to deal with death, not run from it to deal with it.
1944000	1949000	These realites developed a terrible fear of death.
1949000	1951000	Terrible fear of death.
1951000	1958000	It's reminding me of a hadith of the Prophet Salli Shalim when he said that people are going to eat from us like wolves, tear up a sheep.
1958000	1963000	And he said, what's the, when he was asked, Malmalja, how are we going to get out of this?
1963000	1965000	He said, remember death a lot, right?
1965000	1968000	And that's some people look at that and say, why shouldn't I remember death a lot?
1968000	1969000	It's depressing.
1969000	1973000	The point of that hadith is people will become so obsessed with what?
1973000	1978000	Life that they don't want to accept the reality of death.
1978000	1980000	It's not that you should wake up and say, I'm going to die.
1980000	1982000	Breakfast, I'm going to die.
1982000	1984000	You're going to have lunch, I'm going to die.
1984000	1986000	That's not what's being said.
1986000	1991000	It's just that you're so engulfed in life that you're denying the reality of death.
1991000	1993000	You're denying that this life is a journey.
1993000	1996000	And this was something that they before us, you know,
1996000	2004000	they're not going to be getting away from punishment if they no longer how much, how long they live.
2004000	2006000	Here's another one that they did.
2006000	2008000	They had this problem. Alhamdulillah.
2008000	2012000	We don't have this problem anywhere in the Muslim world.
2012000	2014000	You're alimuna nasa siha.
2014000	2018000	They used to teach people, the angels were sent to teach them magic.
2018000	2020000	And they were told when you learn magic,
2020000	2025000	if you learn this, you'll become kafir.
2025000	2027000	And they would learn things that would cause them harm.
2027000	2029000	You mayu farraqoola bihi bayin al-lalhi was a uji.
2029000	2034000	They would especially learn magic that would cause marriages to break up or a proposal to not go through.
2034000	2036000	Or this girl should never get married.
2036000	2039000	Or that guy should become sick before his engagement happens.
2039000	2044000	Or this is what they, this is where a lot of the magic industry went with them.
2044000	2046000	Alhamdulillah, we don't do that.
2046000	2048000	We're good.
2048000	2052000	Wa-lāhum bi-dhāri nabihī min-ahadil l-lābīdilā.
2052000	2056000	You couldn't be harming anybody with this kind of stuff except by Allah's permission.
2056000	2059000	Wa-yate'allam ulamayyaduruhum alayyamfa'uhum.
2059000	2062000	And they would only learn something that would harm them and not benefit them.
2062000	2065000	Wa-lābīt samāsharul bihi anfusahum.
2065000	2068000	Wa-lāqad alimu lamanishtara'um ala'u fil-ākhirati min-khadā'a.
2068000	2071000	And they knew whoever uses any of this or tries to do any of this
2071000	2074000	will have no portion in the akhira.
2074000	2076000	What a horrible thing they sold themselves for.
2076000	2081000	If they only knew, lo kan li'alam.
2081000	2086000	Min-adadīnahadu yuharrifūn al-kalīmā amma wādi'i.
2086000	2093000	Among the Israelites, the Jews, there are some who remove the word from its place.
2093000	2096000	Allah says one thing, they say, no, that's not what it means, this is what it means.
2096000	2099000	That's not what it says, this is what it says.
2099000	2100000	Messing with the words.
2100000	2104000	Now with the Qur'an, we can't change the word of Allah, right?
2104000	2105000	Here's a creative exercise.
2105000	2107000	Okay, we can't change the words.
2107000	2110000	Let's just tell people, I know this is what it says,
2110000	2115000	but it says X, but what it really means is Y.
2115000	2117000	I know it says X, I know, I know.
2117000	2120000	I know Allah is the best speaker, and he's very clear in his speech.
2120000	2123000	But what this really means is something else.
2123000	2128000	Or, oh, this is what the ayah is, but no, no, no, this ayah, we don't know how to follow this ayah.
2128000	2130000	We have to follow this ayah.
2130000	2132000	What?
2132000	2134000	Yuharrifūn al-kalīmā amma wādi'i.
2134000	2136000	Yakūluna sama'ina wa'a'asayna.
2136000	2137000	And they say, we hear and we disobey.
2137000	2139000	Wasma'a ghayla wa'sma'in.
2139000	2141000	And we hear in a way that shouldn't be heard.
2141000	2144000	Wa ra'ina layyam bi'a'asinati.
2144000	2147000	Meaning they twist their tongue and make insults.
2147000	2148000	Ta'anan fiddīn.
2148000	2150000	They are sarcastic in the matter of religion.
2150000	2152000	Wa qalū an'ahu wa la'u an'ahu.
2152000	2153000	Wa la'u an'ahu wa'sma'u an'ahu.
2153000	2154000	Wa'sma'u an'ahu wa'sma'u an'ahu.
2154000	2157000	And if they had only heard and obeyed, wa'sma'u an'ahu wa'sma'u an'ahu.
2157000	2159000	And had listened and said, wait for us.
2159000	2161000	La qāna khayran la'u an'ahu wa'a'ahu.
2161000	2164000	There would have been better for them.
2164000	2166000	They, okay, here's the next one.
2166000	2171000	Again, something, al-ḥamdu liLlāh, we are immune.
2171000	2176000	They, he says, and you know, he says,
2176000	2179000	ma yawaddu lladheena kafurumil an'al kitā'u wa l-al-mushinkīn
2179000	2181000	an'u nazzala aalaykum min khayri'ma rabbikum.
2181000	2185000	They never want that something good should come to you.
2185000	2188000	They hate that something good should come to you.
2188000	2190000	Wa la'u yashtasubi r-rahmati himayyasha.
2190000	2195000	And the knowledgeable among them hate that you now have revelation.
2195000	2198000	Meaning they feel like if you have knowledge of revelation,
2198000	2200000	then people are not going to come to us.
2200000	2202000	They're not going to be impressed with our knowledge now
2202000	2204000	because you have that knowledge.
2204000	2207000	So they don't want that for you.
2207000	2212000	Muslims within each other, you know, even in the Islamic space.
2212000	2214000	Even in the Islamic space.
2214000	2216000	You know, sometimes you can learn something good
2216000	2218000	from someone who knows a lot less than you.
2218000	2221000	Is that possible? Right?
2221000	2225000	But you notice that sometimes there's somebody who knows a lot more
2225000	2227000	and someone who knows a lot less.
2227000	2231000	But the one who knows a lot less is a lot more popular.
2231000	2232000	Yeah?
2232000	2235000	And the one who knows a lot more gets really upset.
2235000	2238000	But the guy who knows a lot less is more popular.
2238000	2241000	And maybe he says some wrong things, whatever he says.
2241000	2243000	But does he say something good also?
2243000	2245000	Yeah, he said me, this is something good.
2245000	2247000	Now, when you can do two things, you could say,
2247000	2250000	Hey, mashā'Allah, you're popular, you're reaching a lot of people.
2250000	2254000	Here are some mistakes you're making. Let me help you with them privately.
2254000	2257000	Because you care about this person and the good that they do.
2257000	2259000	But is that what we do?
2259000	2264000	Let me now, because I'm less popular, let me now announce to the world
2264000	2269000	how wrong this person is and highlight all of the wrong that they do.
2269000	2273000	And then tell people, yeah, there's some good things, mashā'Allah.
2273000	2274000	But you know what?
2274000	2278000	Those good things don't count for anything because look at all these wrongs.
2278000	2280000	Look at all these mistakes.
2280000	2285000	They cannot stand that something good might come from someone else.
2285000	2286000	You can't.
2286000	2289000	What is, you know, our religion has very simple principles.
2289000	2292000	If I have a problem with someone, what should I do?
2292000	2295000	Talk about them or talk to them?
2295000	2296000	Talk to them.
2296000	2298000	Our religion has very simple principles.
2298000	2304000	Hide the faults of your brother and sister or broadcast the faults of your brother and sister.
2304000	2306000	What is it?
2306000	2312000	Whoever covers a believer, Allah covers them on judgment day.
2312000	2317000	A lot of our Islamic content now is dedicated to one person destroying another person.
2317000	2318000	Yes or no?
2318000	2322000	My question is, that person who wanted to destroy that other person,
2322000	2327000	couldn't email them, couldn't find their phone number, couldn't go to their masjid,
2327000	2331000	couldn't go to their, didn't have a conversation with them, couldn't sit and talk, they couldn't do that.
2331000	2334000	They had to go to the world first and say what a kafir they are first.
2334000	2336000	That was step one.
2336000	2337000	This is what I don't understand.
2337000	2341000	There's one thing that you, you know, at least you talk to the person.
2341000	2344000	You talk to them, you have a conversation with them.
2344000	2345000	You know?
2345000	2350000	And even on top of that, my own theory, you don't have to agree with this.
2350000	2352000	Human beings will always disagree with each other.
2352000	2356000	And no human being will ever be perfect.
2356000	2360000	You could spend your energy describing how wrong someone else is,
2360000	2364000	or you could spend your energy showing, doing something right.
2364000	2367000	You could, you decide where you want to put your energy.
2367000	2368000	You know?
2368000	2373000	Some people, some people's entire religion just becomes correcting someone else,
2373000	2375000	knocking somebody else down.
2375000	2376000	Right?
2376000	2379000	And if somebody else is actually doing something really terrible,
2379000	2382000	or it's a very wrong idea that they're spreading, you know what?
2382000	2386000	Ideas should be attacked.
2387000	2391000	The Quran teaches us to attack ideas, instead of attacking what?
2391000	2392000	People.
2392000	2396000	We become obsessed with attacking people, instead of ideas.
2396000	2401000	Now the thing is, when you attack a person, that person is made up of good ideas and bad ideas.
2401000	2405000	When you attack that person, you have refuted everything.
2405000	2409000	But if you attack ideas, then you are making everyone move up.
2409000	2410000	You're helping each other.
2410000	2412000	But this, this is not what they did.
2412000	2414000	They don't like that good would come to somebody else.
2414000	2416000	There's one last one.
2416000	2418000	Adhan has also been given.
2422000	2425000	They started believing nobody will enter Jannah except us.
2425000	2428000	These are the wishful thoughts.
2428000	2429000	How to burhanakum?
2429000	2430000	Bring your proof.
2430000	2432000	I'll say bring your proof.
2432000	2438000	Is there any ayah in the Quran that says nobody will enter Jannah except you people?
2438000	2442000	That Allah give us a guarantee that you and I are going to enter Jannah.
2442000	2443000	No.
2443000	2444000	He says,
2444000	2445000	koo an fusakum ba'aadikum nara.
2445000	2447000	Save yourselves and your families from the fire.
2447000	2448000	He says,
2448000	2451000	ya ayu an nadina amanu koo an fusakum ba'aadikum nara.
2451000	2452000	He didn't say,
2452000	2455000	ya ayu an nadina katharu koo an fusakum ba'aadikum nara.
2455000	2456000	He said,
2456000	2459000	those of you who believe, save yourselves and your families from the fire.
2459000	2460000	Wait.
2460000	2461000	No, no, no.
2461000	2462000	Bur believers.
2462000	2463000	We're already safe.
2463000	2466000	This should be said to those who don't believe.
2466000	2470000	The rest of you, save yourselves from the fire, because we are already on the safe side.
2470000	2475000	No, he says, those of you who believe, save yourselves and your families from the fire.
2475000	2476000	What does that tell you?
2476000	2479000	Believers don't have a false sense of security.
2479000	2486000	And because they don't have that, they're not, they don't have any mental energy to decide who is and isn't going to help.
2486000	2491000	They don't have energy for that, because they've got to worry about themselves.
2491000	2492000	They've got to worry about them.
2492000	2496000	How many people come to me and say, what's going to happen to Mother Teresa?
2497000	2499000	Is that your concern on Judgment Day, bro?
2499000	2506000	Like honestly, when we rise and you see the sun and the moon colliding with each other and the oceans boiling, you're like, where's Mother Teresa?
2510000	2515000	Well, are you honestly going to be the day on which a mother will drop her baby?
2516000	2519000	The day on which a person will run from their own family.
2519000	2522000	You're like, but I have a good coworker.
2522000	2525000	I'm just wondering if they're going to go to hell or not.
2527000	2529000	Why is this even your concern?
2529000	2531000	Do you not believe in Allah the just?
2531000	2534000	Do you not believe in Allah the knower of all things?
2534000	2540000	Do you not believe in Allah who understands the inside and the outside?
2540000	2543000	Why do you have to have an answer?
2543000	2549000	And if I say, if I help you out and say, you know what, your coworker, nice guy, yeah, Allah will put him in jannah.
2549000	2550000	You are not sure.
2552000	2554000	We're not even sure about ourselves, are we?
2555000	2557000	Then why do you want guarantees for someone else?
2557000	2559000	Where did this mentality come from?
2559000	2560000	It came from we're already saved.
2560000	2564000	I want other people to join the saved group.
2565000	2566000	This is self-righteousness.
2566000	2572000	Don't declare yourselves pure.
2572000	2574000	Don't declare yourself saved.
2574000	2576000	He knows better who has taqwa.
2576000	2578000	They developed this mentality.
