start	end	text
2578000	2581000	And unfortunately, and we didn't even say, well, Muslims are saved.
2581000	2582000	We don't say that.
2582000	2585000	We say my version of Muslims are saved.
2585000	2595000	My people, my mentor, my sheikh, my whoever, and the people that wear the same uniform as me, wear the saved ones.
2595000	2597000	Everybody else, you know, they're just barbecued.
2601000	2604000	These, this is what, why do I go through all of these ayat?
2604000	2605000	Allah said what?
2605000	2609000	Those who were given the burden of the Torah and they didn't carry it.
2609000	2612000	They took the religion and made it into something else.
2613000	2614000	This is not what Allah gave.
2614000	2616000	They turned it into a different religion altogether.
2617000	2619000	And Allah says, this is this.
2619000	2622000	I'm giving you this example because now you have been privileged.
2622000	2624000	Don't make these mistakes.
2625000	2628000	And if we have been making these mistakes, enough of us, not all of us,
2628000	2630000	but enough of us have been making these mistakes,
2630000	2632000	now it's time we put a stop to it.
2633000	2636000	Now it's time we, you know, we have to study the Israelites
2636000	2639000	as we are studying ourselves, actually.
2640000	2641000	You know what, in medical school they do, right?
2641000	2643000	They study the cadaver, the dead body,
2644000	2646000	because they're actually studying the future patient.
2647000	2650000	We're studying the Israelites, not to study the Israelites.
2650000	2652000	We're studying them to study ourselves.
2652000	2655000	The Lord, that's what we're honest, but Allah's guidance for us.
2655000	2657000	Not fun facts from history.
2658000	2662000	So as I leave you, one of the, this is not where it gets things really cool.
2662000	2664000	I'll tell you at the end of after the prayer,
2664000	2666000	but one of the things I will share with you,
2666000	2670000	the example given was of a donkey that carries a burden.
2670000	2671000	Check this out.
2672000	2675000	One of the sages of the school of Eliyahu taught,
2675000	2678000	this is Jewish literature, the rabbinical literature.
2678000	2681000	This is the Babylonian Talmud.
2681000	2685000	A person should always make himself subjugated to matters of the Torah,
2685000	2689000	like an ox to a yoke, and like a donkey to a burden.
2690000	2694000	So the Torah actually said you should be committed to the book,
2694000	2698000	like a donkey is committed to the burden on it.
2698000	2701000	So they use this analogy to say,
2701000	2705000	this demonstrates how committed you should be to the book of Allah.
2705000	2708000	Allah took that image and reversed it and said,
2708000	2711000	yes, the analogy is true, but you actually became someone
2711000	2715000	who has no idea what it's carrying, like a donkey carrying a bunch of books.
2715000	2718000	The analogy is actually not originally Oran,
2718000	2722000	the analogy is actually taken from rabbinical literature
2722000	2725000	and being re-engineered to make this point.
2726000	2731000	So how Allah, okay, and then we'll discuss more of this after the Salat.
2731000	2734000	Barakallahu wa Alaykum, As-salamu alaykum wa rehmatullah.
2734000	2737000	Here's what's coming up in the next episode
2737000	2739000	and this deeper look of Surat al-Jumu'ah.
2739000	2744000	So the donkey that was trying to get rid of its burden ended up carrying even more.
2744000	2747000	Which is an interesting analogy because the Israelites,
2747000	2749000	they tried to play with the word of Allah
2749000	2753000	and the more they tried to play with it, life became more and more difficult for them.
2753000	2756000	The more complications came in their life.
2756000	2759000	Obeying the word of Allah makes life easy.
2759000	2762000	Disobeying the word of Allah makes life difficult.
2762000	2766000	That is the Quran's formula that's always been there since the beginning.
