start	end	text
1375000	1378000	You said brothers made something convenient for themselves.
1378000	1379000	It's okay.
1379000	1381000	Obviously, Dad doesn't love us.
1381000	1383000	It's okay if we just take one, we're not killing all the brothers,
1383000	1385000	we're just killing one of them.
1385000	1388000	And we're going to be good after that.
1388000	1391000	سَوْوَلَتْ لَكُمْ عَنْفُسُكُمْ عَمْرَى
1391000	1394000	You know, this is actually something that we have to really,
1394000	1396000	really learn about.
1396000	1398000	قَدَّ تَقْدِيمُ الْأَيدْ
1398000	1400000	What is it that we are prioritizing?
1400000	1404000	Is it that impulse that is a bigger priority than the word of Allah?
1404000	1406000	For men or for women?
1406000	1409000	What is keeping me from praying?
1409000	1413000	What's keeping me from giving up the haram money that I'm making?
1413000	1414000	What's keeping me?
1414000	1416000	What's keeping me from lying?
1416000	1419000	What's keeping me from giving the money that I owe?
1419000	1421000	To I borrowed somebody's money, I didn't give it back.
1421000	1424000	What's keeping me from giving back that money?
1424000	1427000	Something else became a priority over the word of Allah
1427000	1430000	and those are the kinds of people who will never wish to meet with Allah.
1430000	1432000	They can't. How can they?
1432000	1433000	How can they?
1433000	1434000	وَدَا يَتَمَنَّا وُنَّا
1434000	1436000	وُعَبَدَنْ بِمَا قَدَّمَدْ اَيْدِيمِ
1436000	1438000	By the way, those kinds of people,
1438000	1442000	when they have that, it's called cognitive dissonance,
1442000	1445000	meaning they're believers, but they prioritize the wrong thing
1445000	1447000	and they know they're violating the word of Allah.
1447000	1449000	You know what they do then?
1449000	1450000	The Quran is so accurate.
1450000	1451000	You know what they do?
1451000	1454000	They talk a lot about the mercy of Allah.
1454000	1458000	Those people talk a lot about how Allah forgives,
1458000	1461000	how Allah is merciful, how Allah is so loving,
1461000	1464000	how Allah is so kind, how Allah knows what you're going through.
1464000	1466000	Allah is for... Why?
1466000	1470000	Because there's another side to your relationship with Allah
1470000	1471000	that they don't want to deal with.
1471000	1472000	You know what that side is?
1472000	1473000	You're going to stand in front of Allah.
1473000	1476000	You're going to explain yourself what you did, what you did.
1476000	1478000	I don't want to deal with that part of it.
1478000	1480000	I want to deal with Allah is my friend.
1480000	1481000	What did I say?
1481000	1484000	قُلْ يَا يُهَلَّتِنْهَا دُوْ إِنْزَعَنْتُمْ
1484000	1485000	أَنَّكُمْ أَوْ لِيَا أُولِ اللَّهِ
1485000	1488000	مِنْ دُونِ النَّاسْ بَتَمَنَّا وُلْمَوتِنْ كُدُمْ صَدِقْرِينْ
1488000	1490000	Why do they think they're friends with Allah?
1490000	1493000	Because if you're friends, Allah is always going to be okay with me.
1493000	1494000	I'm going to be saved.
1494000	1495000	Allah is merciful.
1495000	1496000	Allah is loving.
1496000	1499000	Allah is guaranteeing me Jannah.
1499000	1501000	That's because the wrong priorities.
1501000	1507000	It's the wrong priorities that say, I'm going to look at one dimension of my relationship with God, not the other.
1507000	1509000	Not the other.
1509000	1515000	And understand from this the Christian concept of God is God is love.
1515000	1516000	Right?
1516000	1519000	For the Israelites, the God is the savior of the Israelites.
1519000	1521000	He's the God of Israel.
1521000	1523000	Actually, he's the God of Israel.
1523000	1530000	For Muslims, Allah is many names at the same time.
1530000	1533000	So he loves us more than we can love ourselves.
1533000	1536000	He can judge us more than anybody else can judge us.
1536000	1540000	He can hold us responsible, accountable more than anybody else can.
1540000	1542000	It's not one relationship.
1542000	1544000	It's multiple relationships.
1544000	1550000	We don't get to pick one of them and say, I'm going to ignore the others because of our own issues.
1550000	1557000	So what we do is we, because we have our own issues, we hold on to some names of Allah and forget other names of Allah.
1557000	1560000	And that's exactly what they did in Awliya.
1560000	1561000	We did not do it without people.
1561000	1563000	We hope that death will come to the truthful.
1563000	1565000	We hope that it will never come to them.
1565000	1570000	And Allah knows who the wrongdoers are.
1570000	1571000	Allah knows the wrong you're doing.
1571000	1572000	Allah knows fully well.
1572000	1575000	You see how interrogative that is?
1575000	1580000	What a precise surgical response that is from Allah.
1580000	1582000	Now, this is a scary picture.
1582000	1583000	But okay.
1583000	1585000	Thank you, Lean.
1585000	1587000	Okay, let's see why that's scary.
1588000	1593000	Here's what's coming up in the next episode and this deeper look of Surat Al-Jumu'ah.
1593000	1598000	A'mal means to do something and fi'il also means to do something.
1598000	1601000	But when you do something without thinking about it, it's a fi'il.
1601000	1603000	So any action can be a fi'il.
1603000	1604000	Breathing right now for me is a fi'il.
1604000	1607000	When I open my eyes and I see you guys, that's a fi'il.
1607000	1610000	But if I choose one person to stare at, then that would be a amal.
1610000	1612000	Because it's a conscious act.
1612000	1614000	So amal includes intent.
1614000	1619000	Fi'il does not include intent necessarily, but amal absolutely includes intent.
1619000	1625000	So Allah is saying, He will inform you of the things you did intently, knowingly, consciously.
1625000	1626000	Okay?
1626000	1629000	Now we're coming to the most exciting part before the break.
1629000	1631000	I need five minutes, guys.
1631000	1632000	Is that okay?
1632000	1633000	Five minutes.
1633000	1634000	Okay.
1634000	1638000	We've finished two sections of the Surah today.
1638000	1641000	And I'm going to give you a review of Section 1.
1641000	1644000	Section 1 was like this.
1644000	1646000	Everything in the skies and the earth does to speed.
1646000	1649000	You sabbihulillahimafi al-samawati wumafil ard.
1649000	1650000	You remember that?
1650000	1651000	Then He was the king.
1651000	1657000	Al-malik, then al-Quddus, then al-Azeez, then al-Hakeem.
1657000	1660000	Then Allah said, He sent to you.
